[
  {
    "source_id": "PLAT-DOC-001",
    "title": "AIConnex Master Final Architecture",
    "knowledge_domain": "platform",
    "source_type": "Architecture Spec",
    "source_location": "aiconnex_knowledge/02_platform/architecture/aiconnex_final_master_architecture.md",
    "authority_level": "A",
    "owner": "AIConnex Engineering",
    "tenant_scope": "global",
    "license": "Internal",
    "version": "1.0",
    "status": "Approved",
    "approved_at": "2026-08-13T12:00:00"
  },
  {
    "source_id": "PLAT-DOC-002",
    "title": "AIConnex System Architecture Master Guide",
    "knowledge_domain": "platform",
    "source_type": "Architecture Spec",
    "source_location": "aiconnex_knowledge/02_platform/architecture/aiconnex_system_architecture_master_guide.md",
    "authority_level": "A",
    "owner": "AIConnex Engineering",
    "tenant_scope": "global",
    "license": "Internal",
    "version": "1.0",
    "status": "Approved",
    "approved_at": "2026-08-13T12:00:00"
  },
  {
    "source_id": "PLAT-DOC-003",
    "title": "AIConnex Complete Execution Flow",
    "knowledge_domain": "platform",
    "source_type": "Flow Spec",
    "source_location": "aiconnex_knowledge/02_platform/architecture/aiconnex_complete_flow.md",
    "authority_level": "A",
    "owner": "AIConnex Engineering",
    "tenant_scope": "global",
    "license": "Internal",
    "version": "1.0",
    "status": "Approved",
    "approved_at": "2026-08-13T12:00:00"
  },
  {
    "source_id": "PLAT-DOC-004",
    "title": "Chatbot Unified Migration and Cleanup Plan",
    "knowledge_domain": "platform",
    "source_type": "Architecture Plan",
    "source_location": "aiconnex_knowledge/02_platform/architecture/2026-08-04-chatbot-migration-and-cleanup.md",
    "authority_level": "A",
    "owner": "AIConnex Engineering",
    "tenant_scope": "global",
    "license": "Internal",
    "version": "1.0",
    "status": "Approved",
    "approved_at": "2026-08-13T12:00:00"
  },
  {
    "source_id": "PLAT-DOC-005",
    "title": "Core ML 9-Node DAG Pipeline Architecture",
    "knowledge_domain": "platform",
    "source_type": "ML Platform Spec",
    "source_location": "aiconnex_knowledge/02_platform/ml_platform/Core_ML_DAG_Pipeline_Diagram.md",
    "authority_level": "A",
    "owner": "AIConnex Engineering",
    "tenant_scope": "global",
    "license": "Internal",
    "version": "1.0",
    "status": "Approved",
    "approved_at": "2026-08-13T12:00:00"
  },
  {
    "source_id": "DATA-DOC-001",
    "title": "HTDS Effluent Branching & Preference Spec",
    "knowledge_domain": "dataset",
    "source_type": "Dataset Branching Spec",
    "source_location": "aiconnex_knowledge/02_platform/contracts/htds_effluent_preference_and_branching_spec.md",
    "authority_level": "A",
    "owner": "AIConnex Engineering",
    "tenant_scope": "global",
    "license": "Internal",
    "version": "1.0",
    "status": "Approved",
    "approved_at": "2026-08-13T12:00:00"
  },
  {
    "source_id": "DATA-DOC-002",
    "title": "NASA C-MAPSS Branching & Preference Spec",
    "knowledge_domain": "dataset",
    "source_type": "Dataset Branching Spec",
    "source_location": "aiconnex_knowledge/02_platform/contracts/nasa_cmapss_preference_and_branching_spec.md",
    "authority_level": "A",
    "owner": "AIConnex Engineering",
    "tenant_scope": "global",
    "license": "Internal",
    "version": "1.0",
    "status": "Approved",
    "approved_at": "2026-08-13T12:00:00"
  },
  {
    "source_id": "PLAT-DOC-008",
    "title": "Multi-Table ZIP Dataset Compiler Audit",
    "knowledge_domain": "platform",
    "source_type": "Compiler Spec",
    "source_location": "aiconnex_knowledge/02_platform/compiler/multi_table_zip_dataset_audit.md",
    "authority_level": "A",
    "owner": "AIConnex Engineering",
    "tenant_scope": "global",
    "license": "Internal",
    "version": "1.0",
    "status": "Approved",
    "approved_at": "2026-08-13T12:00:00"
  },
  {
    "source_id": "PLAT-DOC-006",
    "title": "AIConnex Master Technical Architecture Diagram",
    "knowledge_domain": "platform",
    "source_type": "Architecture Spec",
    "source_location": "aiconnex_knowledge/02_platform/architecture/AIConnex_Master_Technical_Architecture_Diagram.md",
    "authority_level": "A",
    "owner": "AIConnex Engineering",
    "tenant_scope": "global",
    "license": "Internal",
    "version": "1.0",
    "status": "Approved",
    "approved_at": "2026-08-13T12:00:00"
  },
  {
    "source_id": "PLAT-DOC-007",
    "title": "Multi-Tenant Customer Journey Sequence Diagram",
    "knowledge_domain": "platform",
    "source_type": "Flow Spec",
    "source_location": "aiconnex_knowledge/02_platform/workflows/Customer_Journey_Sequence_Diagram.md",
    "authority_level": "A",
    "owner": "AIConnex Engineering",
    "tenant_scope": "global",
    "license": "Internal",
    "version": "1.0",
    "status": "Approved",
    "approved_at": "2026-08-13T12:00:00"
  },
  {
    "source_id": "PLAT-DOC-009",
    "title": "AIConnex Executive Pitch Deck & Business Storyboard",
    "knowledge_domain": "platform",
    "source_type": "Business Spec",
    "source_location": "aiconnex_knowledge/02_platform/architecture/AIConnex_Executive_Pitch_Deck.md",
    "authority_level": "A",
    "owner": "AIConnex Engineering",
    "tenant_scope": "global",
    "license": "Internal",
    "version": "1.0",
    "status": "Approved",
    "approved_at": "2026-08-13T12:00:00"
  },
  {
    "source_id": "PLAT-DOC-010",
    "title": "Timeline & Market Gap Diagram Guide",
    "knowledge_domain": "platform",
    "source_type": "Visual Spec",
    "source_location": "aiconnex_knowledge/02_platform/architecture/Slide4_Timeline_Diagram_Guide.md",
    "authority_level": "A",
    "owner": "AIConnex Engineering",
    "tenant_scope": "global",
    "license": "Internal",
    "version": "1.0",
    "status": "Approved",
    "approved_at": "2026-08-13T12:00:00"
  },
  {
    "source_id": "PLAT-DOC-011",
    "title": "AIConnex System Deep Architecture Audit",
    "knowledge_domain": "platform",
    "source_type": "Audit Spec",
    "source_location": "aiconnex_knowledge/02_platform/architecture/deep_system_audit.md",
    "authority_level": "A",
    "owner": "AIConnex Engineering",
    "tenant_scope": "global",
    "license": "Internal",
    "version": "1.0",
    "status": "Approved",
    "approved_at": "2026-08-13T12:00:00"
  },
  {
    "source_id": "SRC-IND-ONT-001",
    "title": "Basic Formal Ontology 2020 (BFO 2020 - ISO/IEC 21838-2)",
    "knowledge_domain": "industrial",
    "source_type": "Formal Ontology (OWL/TTL)",
    "source_location": "Industrail_KB_raw_data/01_ontologies_and_repositories/BFO-2020-master.zip",
    "authority_level": "A",
    "owner": "ISO/IEC & BFO Consortium",
    "tenant_scope": "global",
    "license": "BSD-3-Clause",
    "version": "2020",
    "status": "Approved",
    "approved_at": "2026-08-14T07:10:35.582986+00:00"
  },
  {
    "source_id": "SRC-IND-ONT-002",
    "title": "Basic Formal Ontology Legacy Repository (BFO Master)",
    "knowledge_domain": "industrial",
    "source_type": "Formal Ontology (OWL)",
    "source_location": "Industrail_KB_raw_data/01_ontologies_and_repositories/BFO-master.zip",
    "authority_level": "B",
    "owner": "BFO Consortium",
    "tenant_scope": "global",
    "license": "BSD-3-Clause",
    "version": "1.1/2.0 Legacy",
    "status": "Approved",
    "approved_at": "2026-08-14T07:10:35.582986+00:00"
  },
  {
    "source_id": "SRC-IND-ONT-003",
    "title": "Circular Economy Ontology Catalogue (CEON)",
    "knowledge_domain": "industrial",
    "source_type": "Formal Ontology (RDF/TTL)",
    "source_location": "Industrail_KB_raw_data/01_ontologies_and_repositories/Circular-Economy-Ontology-Catalogue-main.zip",
    "authority_level": "A",
    "owner": "CEON Project",
    "tenant_scope": "global",
    "license": "CC-BY-4.0",
    "version": "1.0",
    "status": "Approved",
    "approved_at": "2026-08-14T07:10:35.582986+00:00"
  },
  {
    "source_id": "SRC-IND-ONT-004",
    "title": "Industrial Ontology Foundry (IOF) Core & Maintenance Ontologies",
    "knowledge_domain": "industrial",
    "source_type": "Formal Ontology (RDF/OWL)",
    "source_location": "Industrail_KB_raw_data/01_ontologies_and_repositories/IOF-ontology-master.zip",
    "authority_level": "A",
    "owner": "Industrial Ontology Foundry",
    "tenant_scope": "global",
    "license": "CC-BY-4.0",
    "version": "2024",
    "status": "Approved",
    "approved_at": "2026-08-14T07:10:35.582986+00:00"
  },
  {
    "source_id": "SRC-IND-ONT-005",
    "title": "ROMAIN Industrial Maintenance Ontology",
    "knowledge_domain": "industrial",
    "source_type": "Formal Ontology (OWL)",
    "source_location": "Industrail_KB_raw_data/01_ontologies_and_repositories/ROMAIN-master.zip",
    "authority_level": "A",
    "owner": "ROMAIN Maintenance Group",
    "tenant_scope": "global",
    "license": "CC-BY-4.0",
    "version": "1.0",
    "status": "Approved",
    "approved_at": "2026-08-14T07:10:35.582986+00:00"
  },
  {
    "source_id": "SRC-IND-STD-001",
    "title": "IEC 60812:2018 Failure Modes and Effects Analysis (FMEA and FMECA)",
    "knowledge_domain": "industrial",
    "source_type": "International Standard",
    "source_location": "Industrail_KB_raw_data/02_standards_and_guidelines/IEC_60812_2018_FMEA_FMECA.pdf",
    "authority_level": "A",
    "owner": "IEC / ISO",
    "tenant_scope": "global",
    "license": "IEC Copyright Standard",
    "version": "2018",
    "status": "Approved",
    "approved_at": "2026-08-14T07:10:35.582986+00:00"
  },
  {
    "source_id": "SRC-IND-STD-002",
    "title": "ISO 13379-1 Condition Monitoring and Diagnostics of Machines \u2014 General Guidelines",
    "knowledge_domain": "industrial",
    "source_type": "International Standard",
    "source_location": "Industrail_KB_raw_data/02_standards_and_guidelines/ISO_13379_1_Data_Interpretation_Diagnostics.pdf",
    "authority_level": "A",
    "owner": "ISO",
    "tenant_scope": "global",